{
  "schema": "home-center.approved-source-provenance.v1",
  "product": "home-center",
  "version": "0.45.0",
  "approved_repository": "ControlCenterSoft/home-center-development",
  "approved_revision": "d1aecad176f402e3e2a72dd1107a25cfdb465add",
  "approved_manifest_sha256": "0fd430aa2aa6ad54a92fd0acd751a7cec5c7a1de789e6cf8f5b0505cc0b4c1c6",
  "stable_release_boundary_revision": "2724ef9885eef459fa7daded646e98f73d6469d1",
  "summary": {
    "total": 379,
    "identical": 241,
    "adapted": 6,
    "excluded": 132
  },
  "files": [
    {
      "path": ".github/workflows/ci.yml",
      "approved_sha256": "03011647286ebd2ca187613aa2534035673c85ba350f1d504abd9e8387adfb2c",
      "disposition": "excluded",
      "stable_sha256": null,
      "reason": "stable-release-boundary"
    },
    {
      "path": ".github/workflows/infrastructure-neutrality.yml",
      "approved_sha256": "bec0035162598438766fd71e600fa75eae0b31a08379f45fdd44a8ed0bb20261",
      "disposition": "excluded",
      "stable_sha256": null,
      "reason": "stable-release-boundary"
    },
    {
      "path": ".github/workflows/privacy-boundary.yml",
      "approved_sha256": "4b04760a700cf536cfbfa26e5614e37ff77250a7d7baa76de4edeffbc4d06301",
      "disposition": "excluded",
      "stable_sha256": null,
      "reason": "stable-release-boundary"
    },
    {
      "path": ".github/workflows/publish-deployment-artifact.yml",
      "approved_sha256": "15ffd6dc9a133ffc5fed459c77728017c05b557642bc711a1d45b73c9c371186",
      "disposition": "excluded",
      "stable_sha256": null,
      "reason": "stable-release-boundary"
    },
    {
      "path": ".github/workflows/publish-release.yml",
      "approved_sha256": "ecdc657049e682eab4dbe576fddddb032bb846e5eee916783fdc4daf47ae24e3",
      "disposition": "excluded",
      "stable_sha256": null,
      "reason": "stable-release-boundary"
    },
    {
      "path": ".gitignore",
      "approved_sha256": "d0639a2449bd967fddbc42e47e86549293663ebfc05584adcd616fbb21343d92",
      "disposition": "adapted",
      "stable_sha256": "ca0e0809bcef9946addf167a6dc212d388ba50319170e69a8c64c0e5c78c6b66",
      "reason": "hardened-stable-integration"
    },
    {
      "path": "CERTIFICATES.md",
      "approved_sha256": "184b9bb21e415c4023a5277deb87c3c670cda9650bf309bb3cc8d8d9b4023ab0",
      "disposition": "adapted",
      "stable_sha256": "e67ee151cd75936562bd8901f2b8b86ef1a00bb0b34f5698d2f998c0e18ccb35",
      "reason": "hardened-stable-integration"
    },
    {
      "path": "README.md",
      "approved_sha256": "93657b2ac76192cc2b457c7019c3a7b82afba5d8ee0a50d9a796234de3788814",
      "disposition": "adapted",
      "stable_sha256": "eab252f3da1bc80c5244fba97a1c89c3ac4213d2915f3016e99232aa28e5f0ce",
      "reason": "hardened-stable-integration"
    },
    {
      "path": "VERSION",
      "approved_sha256": "fd0ffde4149bd15f8b246e0625bad7ae9dee486ce63e9b87632f1457bae2c781",
      "disposition": "identical",
      "stable_sha256": "fd0ffde4149bd15f8b246e0625bad7ae9dee486ce63e9b87632f1457bae2c781",
      "reason": "approved-byte-copy"
    },
    {
      "path": "contracts/README.md",
      "approved_sha256": "a1e587c06ad129fe7fdc66ffc2f7aa25b06ab560fe1e8977525956cebb6be6a0",
      "disposition": "adapted",
      "stable_sha256": "baa8ba7f00dd04cdaf1adfb58e6ad05cdb396e727ee371ffa3029413999d1c75",
      "reason": "hardened-stable-integration"
    },
    {
      "path": "contracts/actions/action-registry.v1.schema.json",
      "approved_sha256": "9ead333febc5ff2c1b44f3233d405d79d99884c65d0dcf55be933fccabeccd10",
      "disposition": "identical",
      "stable_sha256": "9ead333febc5ff2c1b44f3233d405d79d99884c65d0dcf55be933fccabeccd10",
      "reason": "approved-byte-copy"
    },
    {
      "path": "contracts/actions/action-request.v1.schema.json",
      "approved_sha256": "444727943861d8bcfb12fc6a67058f3b8d6a7f4d883f599d0edc6b1603d267fa",
      "disposition": "identical",
      "stable_sha256": "444727943861d8bcfb12fc6a67058f3b8d6a7f4d883f599d0edc6b1603d267fa",
      "reason": "approved-byte-copy"
    },
    {
      "path": "contracts/actions/action-result.v1.schema.json",
      "approved_sha256": "053cff747783ff269ff75bb3423e352e62aae6cbdcf1e32ef8f8c5e8396bced5",
      "disposition": "identical",
      "stable_sha256": "053cff747783ff269ff75bb3423e352e62aae6cbdcf1e32ef8f8c5e8396bced5",
      "reason": "approved-byte-copy"
    },
    {
      "path": "contracts/agent/enrollment.v1.schema.json",
      "approved_sha256": "d261cd42a34c47eacc082c4f06b24035a7655201cfc2fbb7f9ed5fd5e545a6c7",
      "disposition": "identical",
      "stable_sha256": "d261cd42a34c47eacc082c4f06b24035a7655201cfc2fbb7f9ed5fd5e545a6c7",
      "reason": "approved-byte-copy"
    },
    {
      "path": "contracts/auth/ad-provider-config.v1.schema.json",
      "approved_sha256": "49c15fe8146266a6feeee1953f2c4e61856de819c22917beae5a18fda2799bed",
      "disposition": "identical",
      "stable_sha256": "49c15fe8146266a6feeee1953f2c4e61856de819c22917beae5a18fda2799bed",
      "reason": "approved-byte-copy"
    },
    {
      "path": "contracts/auth/auth-providers.v1.schema.json",
      "approved_sha256": "1dfba181e48025404c69c490c7e4e6cb7b078a7aacfed8890a0b6cafcfde2cae",
      "disposition": "identical",
      "stable_sha256": "1dfba181e48025404c69c490c7e4e6cb7b078a7aacfed8890a0b6cafcfde2cae",
      "reason": "approved-byte-copy"
    },
    {
      "path": "contracts/auth/local-admin-credential.v1.schema.json",
      "approved_sha256": "2139cfe106a7c28d2b639972f14dfdc6543f43896ac4e367fc90724751a47255",
      "disposition": "identical",
      "stable_sha256": "2139cfe106a7c28d2b639972f14dfdc6543f43896ac4e367fc90724751a47255",
      "reason": "approved-byte-copy"
    },
    {
      "path": "contracts/auth/local-admin-credential.v2.schema.json",
      "approved_sha256": "f79db071e8c6f8454e47c6a815651eeb3b1b56af9b323616bea9464cf819967f",
      "disposition": "identical",
      "stable_sha256": "f79db071e8c6f8454e47c6a815651eeb3b1b56af9b323616bea9464cf819967f",
      "reason": "approved-byte-copy"
    },
    {
      "path": "contracts/auth/local-admin-password-change-result.v1.schema.json",
      "approved_sha256": "383bc74ff9ceb07e55315884b224fca0e2befa9516f6aac3bd2a706c36f9c5f3",
      "disposition": "identical",
      "stable_sha256": "383bc74ff9ceb07e55315884b224fca0e2befa9516f6aac3bd2a706c36f9c5f3",
      "reason": "approved-byte-copy"
    },
    {
      "path": "contracts/auth/local-admin-password-change.v1.schema.json",
      "approved_sha256": "022fc117fd9c0caa40a14650148587fbd016d3ebb9e20e38547e2155124ae591",
      "disposition": "identical",
      "stable_sha256": "022fc117fd9c0caa40a14650148587fbd016d3ebb9e20e38547e2155124ae591",
      "reason": "approved-byte-copy"
    },
    {
      "path": "contracts/auth/local-admin-recovery-evidence.v1.schema.json",
      "approved_sha256": "ee911df7075dddd651b03e78c67818bd58f86ade8e21bf478f428acaa403a111",
      "disposition": "identical",
      "stable_sha256": "ee911df7075dddd651b03e78c67818bd58f86ade8e21bf478f428acaa403a111",
      "reason": "approved-byte-copy"
    },
    {
      "path": "contracts/auth/login-request.v1.schema.json",
      "approved_sha256": "be492cc670738e903fb381851fc9db0a0c59724e1678e3f54add25109ef0db9e",
      "disposition": "identical",
      "stable_sha256": "be492cc670738e903fb381851fc9db0a0c59724e1678e3f54add25109ef0db9e",
      "reason": "approved-byte-copy"
    },
    {
      "path": "contracts/auth/login-request.v2.schema.json",
      "approved_sha256": "86ccb633d70a346bab82ce68425cd1f86b8d24aa7b2bd0f85868891cfeee68c6",
      "disposition": "identical",
      "stable_sha256": "86ccb633d70a346bab82ce68425cd1f86b8d24aa7b2bd0f85868891cfeee68c6",
      "reason": "approved-byte-copy"
    },
    {
      "path": "contracts/authorization/authorization-policy.v1.schema.json",
      "approved_sha256": "282f1cbb1b60c44680865ef90343491f487d191ba1b0ef89e4f3f21b0366a904",
      "disposition": "identical",
      "stable_sha256": "282f1cbb1b60c44680865ef90343491f487d191ba1b0ef89e4f3f21b0366a904",
      "reason": "approved-byte-copy"
    },
    {
      "path": "contracts/authorization/effective-access.v1.schema.json",
      "approved_sha256": "591fe822174303d3a6eb4416d0800e6bae1dffff712f7631838156965fefe621",
      "disposition": "identical",
      "stable_sha256": "591fe822174303d3a6eb4416d0800e6bae1dffff712f7631838156965fefe621",
      "reason": "approved-byte-copy"
    },
    {
      "path": "contracts/automation/action-catalog.v1.schema.json",
      "approved_sha256": "3a515f6f1bfafc8a07a76985772a9e5d667e0a8758d399282ad0b66359d2a712",
      "disposition": "identical",
      "stable_sha256": "3a515f6f1bfafc8a07a76985772a9e5d667e0a8758d399282ad0b66359d2a712",
      "reason": "approved-byte-copy"
    },
    {
      "path": "contracts/automation/automation-plan.v1.schema.json",
      "approved_sha256": "cae8a5d7c07003eef72d50a68c75148cfa2f6190fca46862dd0dd23d772865ec",
      "disposition": "identical",
      "stable_sha256": "cae8a5d7c07003eef72d50a68c75148cfa2f6190fca46862dd0dd23d772865ec",
      "reason": "approved-byte-copy"
    },
    {
      "path": "contracts/automation/runbook-plan-request.v1.schema.json",
      "approved_sha256": "7a501c1037c7e8658914255028f9321c3453b59fb551f5a9b0d4f3074bf222e4",
      "disposition": "identical",
      "stable_sha256": "7a501c1037c7e8658914255028f9321c3453b59fb551f5a9b0d4f3074bf222e4",
      "reason": "approved-byte-copy"
    },
    {
      "path": "contracts/automation/runbook-plan.v1.schema.json",
      "approved_sha256": "18ef64f855eb66a913f73f94d58fd19ed01217c09158684ccc13d34465f4f8d2",
      "disposition": "identical",
      "stable_sha256": "18ef64f855eb66a913f73f94d58fd19ed01217c09158684ccc13d34465f4f8d2",
      "reason": "approved-byte-copy"
    },
    {
      "path": "contracts/backup/backup-manifest.v1.schema.json",
      "approved_sha256": "434bb1993e541a47d7f52194f4480e6c6227586cdafdad8a2478266c7af975bd",
      "disposition": "identical",